{
  "schema_version": "1",
  "snapshot_id": "graph-single",
  "repository": "owner/repo",
  "revision": "def456",
  "nodes": [
    {
      "id": "node-1",
      "label": "health",
      "kind": "function",
      "file": "crates/autodev-server/src/lib.rs",
      "enclosing": null,
      "span": { "start": 0, "end": 64 }
    }
  ],
  "edges": []
}
